{
  "artifact_type": "inspection_evidence_envelope",
  "schema_version": "1.0",
  "evidence_id": "synthetic-fixture-evidence-001",
  "synthetic": true,
  "lifecycle_state": "discovered",
  "package": {
    "slug": "plate-with-holes",
    "revision": "A"
  },
  "subject": {
    "identifier": "synthetic-fixture-part",
    "identifier_type": "part",
    "revision": "A"
  },
  "source": {
    "organization": "Synthetic Fixture Organization",
    "source_type": "qa",
    "source_record_id": "SYNTHETIC-FIXTURE-ONLY",
    "document": {
      "original_filename": "synthetic-source.csv",
      "media_type": "text/csv",
      "size_bytes": 61,
      "sha256": "d931ed36226b1cdadb8771445d29b3632270c769054d24e947495ecb339d4103"
    }
  },
  "inspection": {
    "method": "synthetic fixture method",
    "status": "completed",
    "completed_at": "2026-07-01T01:00:00Z",
    "inspector_identity_ref": "fixture.inspector",
    "overall_result": "pass"
  },
  "review": {
    "reviewer_identity_ref": "fixture.reviewer",
    "reviewed_at": "2026-07-01T02:00:00Z",
    "decision": "approved_for_authorization",
    "notes": "Synthetic fixture only; never production inspection evidence."
  },
  "authorization": {
    "status": "pending",
    "authorization_id": null,
    "record_ref": null,
    "record_sha256": null,
    "authorized_by_ref": null,
    "authorized_at": null,
    "operation_scope": []
  },
  "measured_characteristics": [
    {
      "characteristic_id": "synthetic-characteristic",
      "specification_ref": "SYNTHETIC-SPEC-001",
      "nominal_value": 1.2,
      "measured_value": 1.23,
      "unit": "mm",
      "lower_limit": 1.1,
      "upper_limit": 1.3,
      "result": "pass"
    }
  ],
  "specification_references": [
    "SYNTHETIC-SPEC-001"
  ],
  "provenance": {
    "immutable": true,
    "origin_reference": "synthetic-fixture-origin",
    "received_at": "2026-07-01T00:30:00Z",
    "custody_events": [
      {
        "event_type": "received",
        "occurred_at": "2026-07-01T00:30:00Z",
        "actor_ref": "fixture.receiver",
        "source_sha256": "d931ed36226b1cdadb8771445d29b3632270c769054d24e947495ecb339d4103"
      }
    ]
  },
  "attachment": {
    "requested_at": "2026-07-01T02:30:00Z",
    "attached_at": null
  },
  "confidentiality": {
    "classification": "internal",
    "redaction_status": "reviewed_no_redaction",
    "redacted_fields": []
  }
}
